doc_id,text,gemma3,owl/t-lite,llama3.2,phi4-mini,phi4
ВЕСТИ_43367,"Канада намерена ввести новые санкции против РФ из-за референдумов в Донбассе, Запорожской и Херсонской областях, сообщил премьер-министр Джастин Трюдо.

 @vestiru24 ",Canada; Russia; Sanctions; Referendums; Donbas; Zaporizhzhia; Kherson,Canada; Russia; Sanctions; Ukraine; Referendum,Russia; Ukraine; Canada; Sanctions; Donbass; Zaporizhzhia; Kherson; Referendums; Justin Trudeau,Canada; Russia; Sanctions; Referendums; Donetsk region; Zaporizhzhia region; Kherson region,Canada; Russia; Sanctions; Ukraine; Referendum; Donbas; Zaporizhzhia; Kherson; Justin Trudeau
ВЕСТИ_43381,"Херсонская область в ближайшие дни обратится к президенту РФ по итогам референдума, заявил замглавы ВГА Кирилл Стремоусов.  Он также добавил, что в области гривна выйдет из оборота в ближайшее время.

 @vestiru24 ",Kherson; Referendum; Russia; Ruble; Currency; Politics,Kherson Region; Referendum; Russian President; Currency Exchange,Herson Region; Ukraine; Referendum; Putin; Gryvna,Herzen State University; currency exchange; Russia; Ukraine; Heresonska oblast; Kirill Stremourov,Kherson Region; Referendum; Russian Federation; Kirill Stremousov; State Council; Hryvnia
ВЕСТИ_43400,"❗️ Глава Херсонской области Владимир Сальдо обратился к Путину с предложением о принятии региона в состав России.

 @vestiru24 ",Ukraine; Russia; Kherson; Politics; Conflict,Kherson Region; Ukraine-Russia Conflict; Russian Annexation; Vladimir Saldo; Putin,Russia; Ukraine; Kherson Region; Vladimir Saldo; Vladimir Putin,Herson Region; Ukraine; Russia; annexation; political appeal,Ukraine; Russia; Geopolitics; Annexation; Vladimir Saldo; Kherson Region
ВЕСТИ_43409,"Референдумы в ДНР, ЛНР, Херсонской и Запорожской областях прошли при полной прозрачности и с соблюдением всех избирательных норм.  Об этом заявил на заседании Совета Безопасности ООН постоянный представитель России при всемирной организации Василий Небензя.  ""Знаю, что наши бывшие западные партнеры нас не услышат, точнее, сделают вид, что не услышали, однако скажу, что референдумы были проведены в условиях исключительной прозрачности и при полном соблюдении всех избирательных норм"" , - добавил он.

 @vestiru24 ",Russia; Ukraine; Referendum; Donetsk; Luhansk; Kherson; Zaporizhzhia; UN; Security Council,Referendum; Transparency; Elections; UN Security Council; Russia; Ukraine,Russia; UN; referendum; Donbas; Zaporizhzhia,Russia; UN; Vasiliy Nebenzya; referendum; transparency,UN Security Council; Vasily Nebenzya; referendums; Donetsk People's Republic; Luhansk People's Republic; Kherson region; Zaporizhzhia region; transparency; electoral norms
ВЕСТИ_43411,"⚡️ ""Для нас это большой праздник"" : так Владимир Корнилов прокомментировал прошедшие в ДНР, ЛНР, Херсонской и Запорожской областях референдумы по вопросу присоединения к России. В эфире программы ""60 минут"" эксперт отметил, что организаторы голосования совершили настоящий подвиг, ведь со стороны Украины звучали постоянные угрозы. "" Угрожали арестами, высылками и так далее "", – рассказал Корнилов.  

Смотрим  все выпуски программы ""60 минут""  на нашей платформе.

 @skabeeva   @vladivostok1978  
 @smotrim_ru ",referendum; DPR; LPR; Kherson; Zaporizhzhia; Russia; Ukraine; threats; celebration,Referendum; Russia-Ukraine Conflict; Vladimir Kornilov; 60 Minutes,referendum; Russia; Ukraine; Donbass; Crimea; Kherson; Zaporizhzhia,Vladimir Korniyol; Donetsk People's Republic; Luhansk People's Republic; Kherson Region; Zaporizhzhia Region; Russia-Ukraine conflict; referendum,referendum; annexation; Russia; Ukraine; DNR; LNR; Kherson; Zaporizhzhia; Vladimir Kornilov; 60 minutes program
ВЕСТИ_43414,"Глава Республики Крым Сергей Аксенов вручил российский паспорт заместителю главы ВГА Херсонской области Кириллу Стремоусову.   ""В трудное время Кирилл Сергеевич не побоялся взять на себя ответственность за регион и людей, в сложных обстоятельствах сохранил верную и твердую позицию. А сегодня стал гражданином нашей большой страны. Поздравляю от имени всех крымчан и желаю успехов в служении России"",  - написал Аксенов в своем Telegram-канале.

 @vestiru24 ",Russia; Crimea; Kherson; Passport; Politics; Administration,Russian Citizenship; Ukraine Conflict; Heroism; Sergey Aksyonov; Kirill Stremoysky,Russia; Crimea; Sergey Aksyonov; Kirill Stremousov; Russian Passport; Kremlin-backed official; Integration with Russia,NA,Sergey Aksyonov; Kirill Stremousov; Russian passport; Republic of Crimea; Kherson Regional State Administration; Telegram post; citizenship; Russia
ВЕСТИ_43433,"Еврокомиссия разработала новые предложения по санкциям против России в связи с референдумами в ДНР, ЛНР, Херсонской и Запорожской областях.  Об этом сообщила Урсула фон дер Ляйен.

 @vestiru24 ",European Union; Sanctions; Russia; Ukraine; Donetsk; Luhansk; Kherson; Zaporizhzhia; Ursula von der Leyen,EU sanctions; Ukraine-Russia conflict; referendums; European Commission,EU; Russia; Sanctions; Referendums; Donbass; Luhansk; Zaporizhzhia; Kherson,European Union; Russia; Sanctions; Donetsk People’s Republic; Luhansk People’s Republic,EU; sanctions; Russia; Ukraine; referendums; DNR; LNR; Kherson; Zaporizhzhia; Ursula von der Leyen
ВЕСТИ_43441,"МИД РФ: результаты референдума говорят сами за себя – жители Донбасса, Херсонщины и Запорожья не хотят возвращаться к прежней жизни и сделали осознанный и свободный выбор в пользу России.

 ""Международные наблюдатели из Италии, ФРГ, Венесуэлы, Латвии и других стран (всего 133 человека), следившие за ходом референдумов, признали их итоги легитимными"" , – отметили в ведомстве. 

 @vestiru24 ",Russia; Donetsk; Kherson; Zaporizhzhia; Referendum; International Observers; Politics,Referendum; Donbass; Kherson; Zaporizhzhia; Russia; Integration,Russia; Referendum; Donbass; Zaporizhzhia; Kherson; MFA; International Observers,Russia; Donbas; Kherson Region; Zaporizhzhia Oblast; Referendum; Re-election,Russia; referendum; Donbas; Kherson; Zaporozhye; international observers; legitimacy; foreign ministry
ВЕСТИ_43454,"На адаптацию Херсонской области к российскому законодательству уйдет год,  сообщил глава правительства региона. Другие заявления: 

▪️Херсонская область после проведения референдума считает себя независимой.

▪️Украинский язык в Херсонской области будет использоваться наравне с русским.

 @vestiru24 ",Ukraine; Russia; Kherson Oblast; Referendum; Russian Legislation; Ukrainian Language,Herson Region; Russian Law Adaptation; Governor's Announcement,Russia; Ukraine; Herson Region; Referendum; Independence; Russian Legislation; Language Policy; Bilingualism; Vestiru24,Herson Region; Russia; Ukraine; Legislation; Independence,Kherson Region; Russian Legislation; Referendum; Language Policy
ВЕСТИ_43470,"Украина де-факто прекратила свое существование, а Херсонская область становится полноценным субъектом РФ , заявил заместитель главы ВГА Херсонской области Кирилл Стремоусов.  ""В считаные десятки часов область станет субъектом РФ. Что будет далее с ней? Она будет развиваться. Пример тому есть: Республика Крым, которая за восемь лет расцвела и стала жемчужиной всей России"" , - отметил он в своем Telegram-канале.

 @vestiru24 ",Ukraine; Russia; Kherson; Occupation; Conflict; Politics; Telegram,Ukraine; Russia; Herschel Stremousov; Herson Region; Crimea,NA,Ukraine; Herson Region; Russia; Kirill Stremouosov; Vinnitsa Regional Administration,Ukraine; Russia; Kherson Region; Integration; Crimea
ВЕСТИ_43490,"Депутаты от ЛНР, ДНР, Херсонской и Запорожской областей появятся в Думе после выборов в 2026 году , сообщил замглавы фракции ""Единая Россия"".

 @vestiru24 ",Russia; Ukraine; Donetsk People's Republic; Luhansk People's Republic; Kherson Oblast; Zaporizhzhia Oblast; United Russia; Elections; Politics,Russian Politics; Ukraine Conflict; Donbas Region; Luhansk People's Republic; Kherson and Zaporizhzhia Regions; State Duma,Russia; Donbass; Crimea; State Duma; United Russia; Elections,Russia; Ukraine; Donetsk People's Republic; Luhansk People’s Republic; DPR; LNR; elections; 2026,Russia; State Duma; United Russia; Luhansk People's Republic; Donetsk People's Republic; Kherson region; Zaporozhye region; 2026 elections
ВЕСТИ_43517,"""Люди не хотят возвращаться к прежней жизни. Они достаточно настрадались. Они выстрадали свое будущее, они доказали, что имеют право на мирную жизнь"",  - так официальный представитель МИД РФ Мария Захарова прокомментировала референдумы в ДНР, ЛНР, Херсонской и Запорожской областях. Дипломат в эфире телеканала ""Россия 24"" указала, что люди на этих территориях  ""восстали против террора и развязанной киевским неонацистским режимом многолетней войны с собственным народом"".

 @vestiru24 ",Russia; Ukraine; Referendum; Foreign Ministry; Maria Zakharova; DPR; LPR; Kherson; Zaporizhzhia; Neo-Nazis,Russia; Maria Zakharova; Referendum; Donetsk; Luhansk; Kherson; Zaporizhzhia,Russia; Ukraine; Donbass; Referendum; Maria Zakharova,Russia; Foreign Minister Maria Zakharova; Donetsk People’s Republic; Luhansk People’s Republic; Kherson Region; Zaporizhzhia Oblast,Russia; Ukraine; Referendum; DNR; LNR; Kherson; Zaporizhzhia; Maria Zakharova; MID RF; Conflict
ВЕСТИ_43523,"""Режим Зеленского и его американские кураторы не хотят принимать реальную действительность"",  - указала официальный представитель МИД РФ Мария Захарова, говоря о референдумах в ДНР, ЛНР, Херсонской и Запорожской областях. Дипломат подчеркнула, что  ""они цинично ставят под сомнение процедуру проведения плебисцита и его итоги, считают их ничтожными"".   ""Как там Зеленский говорил – не люди, а ""особи"", да? Поэтому волеизъявление тех самых, которых Зеленский называл ""особями"", ничтожно? Ну нет, это не так"",  - сказала Захарова в эфире телеканала ""Россия 24"".

 @vestiru24 ",Russia; Ukraine; Referendum; Zelensky; US; Diplomacy; Foreign Ministry; Conflict,Russian Foreign Ministry; Maria Zakharova; Ukraine Referendum; Zelenskyy; Western Allies,Zakharova; Kiev; US patrons; referendums; Donbass; Kherson; Zaporizhzhia regions,Russia; Ukraine; US,Ukraine; Russia; referendum; DNR; LNR; Zelensky; Maria Zakharova; U.S. relations
ВЕСТИ_43573,"Владимир Путин подписал указы о признании Херсонской области и Запорожской области независимыми территориями.

 @vestiru24 ",Vladimir Putin; Russia; Ukraine; Kherson; Zaporizhzhia; Territory; Recognition; Conflict,Russia; Ukraine War; Vladimir Putin; Kherson Region; Zaporizhzhia Region,Russia; Ukraine; Vladimir Putin; Kherson Region; Zaporizhzhia Region,Putin; Kherson Region; Zaporizhzhia Region; Ukraine,Russia; Ukraine; Vladimir Putin; Kherson Region; Zaporizhzhia Region; International Relations; Conflict Escalation
ВЕСТИ_43601,"В церемонии принятия новых субъектов в РФ примут участие главы ДНР и ЛНР, Херсонской области и Запорожья,  заявил Дмитрий Песков.

 @vestiru24 ",Russia; DPR; LPR; Kherson; Zaporizhzhia; Integration; Dmitry Peskov; vestiru24,Russia; Ukraine War; Donetsk; Luhansk; Kherson; Zaporizhzhia; Ceremony; Integration,Dmitry Medvedev; Russia; Donetsk region; Luhansk region; Kherson region; Zaporizhzhia region,Russia; Donetsk People’s Republic; Luhansk People’s Republic; Kherson Oblast; Zaporizhzhia region; ceremony; new subjects acceptance,Russia; Donetsk People's Republic; Luhansk People's Republic; Kherson Region; Zaporizhzhia Region; Dmitry Peskov
ВЕСТИ_43613,"Историческое фото: главы ДНР, ЛНР, Запорожской и Херсонской областей прибыли в Кремль.  Главы регионов примут участие в церемонии подписания договоров о вступлении в состав РФ новых территорий.

 @vestiru24 ",Russia; DPR; LPR; Zaporizhzhia; Kherson; Kremlin; Agreement; Territory; Politics,Russia; Ukraine Conflict; Donetsk; Luhansk; Zaporizhzhia; Kherson; Kremlin,Russia; Ukraine; Kremlin; Moscow; Donetsk People's Republic; Luhansk People's Republic; Zaporizhzhia Region; Kherson Region,NA,Kremlin; DNR; LNR; Zaporizhzhia; Kherson; Russia; territorial integration; treaty signing
ВЕСТИ_43615,"❗️ Владимир Путин уведомил Госдуму о предложении ДНР, ЛНР, Херсонской и Запорожской областей войти в состав РФ , сообщил Володин.

 @vestiru24 ",Russia; Ukraine; DNR; LNR; Kherson; Zaporizhzhia; Vladimir Putin; Duma; Russian Federation,Russia; Ukraine Conflict; State Duma; Donetsk People's Republic; Luhansk People's Republic; Kherson Oblast; Zaporizhzhia Oblast,Russia; Donbass; Crimea; Vladimir Putin; State Duma; Proposition; Integration,Putin; Russia; Donetsk Republic; Luhansk People's Republic; Kherson Region; Zaporizhzhia Oblast,Russia; Vladimir Putin; State Duma; DNR; LPR; Kherson; Zaporizhzhia; Geopolitics
ВЕСТИ_43626,"Киев должен с уважением относиться к выбору ДНР, ЛНР, Запорожской и Херсонской областей, только таким может быть путь к миру,  заявил Владимир Путин.

Смотрим трансляцию прямо сейчас в нашем Telegram-канале:  t.me/vestiru24?livestream 

 @vestiru24 ",Ukraine; Russia; Putin; DPR; LPR; Zaporizhzhia; Kherson; Peace; Conflict,Vladimir Putin; Donetsk People's Republic (DNR); Luhansk People's Republic (LPR); Zaporizhzhia Region; Kherson Region; Peace Process,Russia; Ukraine; Conflict; News; Live Updates,Putin; peace; Donetsk; Luhansk; Zaporizhzhia; Kherson,Vladimir Putin; Russia-Ukraine conflict; Donetsk People's Republic; Luhansk People's Republic; Zaporizhzhia; Kherson; peace negotiations
ВЕСТИ_43641,"""Хочу, чтобы меня услышали киевские власти и их реальные хозяева на Западе, чтобы это запомнили все. Люди, живущие в Луганске и Донецке, Херсоне и Запорожье, становятся нашими гражданами. Навсегда "", - заявил президент России Владимир Путин в ходе церемонии подписания договоров о вступлении в состав РФ новых территорий.

Смотрим трансляцию прямо сейчас в нашем Telegram-канале:  t.me/vestiru24?livestream 

 @smotrim_ru ",Russia; Ukraine; Donetsk; Luhansk; Kherson; Zaporizhzhia; Vladimir Putin; Territorial Expansion; International Relations; Telegram,Russia; Ukraine Conflict; Vladimir Putin; Donetsk; Luhansk; Kherson; Zaporizhzhia,Russia; Ukraine; Donbas; Crimea; Zaporozhie,Putin; Russia; Ukraine; Donetsk; Luhansk; Crimea; annexation,Russia; Ukraine; Annexation; Vladimir Putin; Territorial claims
ВЕСТИ_43661,"❗️Путин и глава Херсонской области подписали договор о принятии региона в состав России.

 Смотрим трансляцию прямо сейчас в нашем Telegram-канале:  t.me/vestiru24?livestream 

 @vestiru24 ",Russia; Ukraine; Kherson; Putin; Agreement; Annexation; Telegram,Russia-Ukraine War; Kherson Region; Annexation; Vladimir Putin,ukraine; russia; conflict; live updates,Ukraine-occupied territories; Putin; Russia; Kherson Region,Russia; Kherson Region; Treaty; Incorporation; Live Broadcast
ВЕСТИ_43663,"Владимир Путин и главы ДНР, ЛНР, Запорожской и Херсонской областей подписали договоры о принятии в состав России и образовании новых субъектов Федерации. И в конце все скандировали ""Россия! Россия!"".

 @vestiru24 ",Russia; Donetsk; Luhansk; Zaporizhzhia; Kherson; Ukraine; Russia-Ukraine War; Federal Subjects,Russia; Ukraine; Donbas; Luhansk People's Republic; Zaporizhzhia; Kherson; Vladimir Putin,Russia; Ukraine; Vladimir Putin; Donbas; Zaporizhzhia region; Kherson region,Putin; Donetsk People's Republic; Luhansk People's Republic; Zaporizhzhia region; Kherson region,Vladimir Putin; DNR; LNR; Zaporozhye; Kherson; Russian Federation; new federal subjects; accession treaties
ВЕСТИ_43666,"Президент РФ вместе с главами ДНР, ЛНР, Запорожской и Херсонской областей подписали договоры о принятии новых территорий в состав РФ и образовании субъектов Федерации.  После подписания присутствующие начали скандировать ""Россия! Россия! Россия!"".

 СМОТРИМ полное видео подписания договоров о вступлении в состав РФ

 @smotrim_ru ",Russia; DPR; LPR; Zaporizhzhia; Kherson; Agreement; Joining Russia; Politics; International News,Signing Ceremony; New Territories; Integration; Russian Federation; Donetsk People's Republic; Luhansk People's Republic; Zaporozhye Region; Kherson Region,Russia; Ukraine; Annexation; Crimea,Russia; Presidential Decree; Integration; New Territories,Russia; Donetsk People's Republic; Luhansk People's Republic; Zaporozhye region; Kherson region; treaty signing; federal subjects
ВЕСТИ_43699,"""Дорогие друзья, спасибо вам за то, что вы нас поддерживаете"",  - сказал глава Херсонской области Владимир Сальдо со сцены митинга-концерта ""Выбор людей: Вместе навсегда!"".  ""Мы вместе всегда победим!""  – указал он.

 ➡️Прямая трансляция концерта на медиаплатформе ""Смотрим""

 @vestiru24 ",Vladimir Saldo; Kherson region; concert; political rally; Smotrim; Ukraine; Russia,Saldo; Vladimir Saldo; Huge Concert; Unity; Support; People; Kherson; Media Platform; Смотрим,Hersonskaya Oblast; Vladimir Saldo; Ukraine; Concert; Supporters,Herson Region; Ukraine; Concert; Vladimir Saldo,Vladimir Saldo; Kherson region; concert-rally; unity; live stream; media platform Sмотрим
ВЕСТИ_43704,"Владимир Путин: современная Россия предоставила людям, проживающим в ДНР, ЛНР, Запорожской и Херсонской областях, право выбора - они сделали выбор быть с Россией.

 ➡️Прямая трансляция концерта на медиаплатформе ""Смотрим""

 @vestiru24 ",Vladimir Putin; Russia; Donbas; LNR; Zaporizhzhia; Kherson; Choice; Sмотрым,Russia; Donbass; Luhansk; Zaporizhzhia; Kherson; Vladimir Putin; territorial integration,Russia; Vladimir Putin; Donbass; Lugansk; Zaporizhzhia; Kherson; Regional Elections; Russian President; Modern Russia; Right to Choose; Allegiance; Concert; Media Platform; Sputnik News; Vestiru24,Putin; Russia; Donetsk People’s Republic; Luhansk People’s Republic; Zaporizhzhia Oblast; Kherson Oblast,Vladimir Putin; Russia; DNR; LNR; Zaporozhye; Kherson; Annexation; Geopolitics; Media Broadcast; Soyuz Platform
ВЕСТИ_43708,"""Современная Россия предоставила людям, проживающим в Луганской и Донецкой народных республиках, в Запорожье, в Херсоне право выбора. Люди пришли на референдум и сделали этот выбор - быть со своей исторической Родиной - с Россией!""  - заявил Владимир Путин на митинге-концерте  ""Выбор людей: Вместе навсегда!"" в Москве.

 ➡️Прямая трансляция концерта на медиаплатформе ""Смотрим""

 @vestiru24 ",Russia; Ukraine; Referendum; Donetsk; Luhansk; Zaporizhzhia; Kherson; Vladimir Putin; Concert; Shtorm,Russia; Referendum; Luhansk; Donetsk; Kherson; Vladimir Putin,Russia; Ukraine; Vladimir Putin; Donbas; referendum,Putin; concert; Russia,Vladimir Putin; Russia; Luhansk People's Republic; Donetsk People's Republic; Zaporizhzhia; Kherson; referendum; Ukraine; Moscow concert; political statement
ВЕСТИ_43722,"⚡️ Сергей Лавров спел гимн РФ на церемонии подписания договоров о вхождении ДНР, ЛНР, Запорожской и Херсонской областей в состав России.   ""Я очень люблю наш гимн, как и все, что символизирует нашу Родину, и когда такие моменты и ощущения гордости за свой народ... Ну, не знаю, как-то само собой произошло"",  - рассказал он автору и соведущему программы ""Москва. Кремль. Путин"" на телеканале ""Россия 1""  Павлу Зарубину . Не пропустите новый выпуск в воскресенье вечером на телеканале ""Россия 1""!

 Все подробности только на ""Смотрим"":  smotrim.ru/mkp 

 @smotrim_ru ",Russia; Sergei Lavrov; Russian Anthem; DPR; LPR; Zaporizhzhia; Kherson; Integration; Russia 1; Smotrim.ru,Sergey Lavrov; Russia's Anthem; Donbas; Luhansk; Zaporizhzhia; Kherson Regions; Annexation; Signing Ceremony; Moscow's Kremlin Palace,NA,Sergei Lavrov; Russian Anthem; Ceremony Signing,Sergey Lavrov; Russian National Anthem; Donetsk; Luhansk; Zaporizhzhia; Kherson; Russia; Treaty Signing Ceremony; Channel One Russia
