doc_id,text,gemma3,owl/t-lite,llama3.2,phi4-mini,phi4
ВЕСТИ_388,"В херсонском отделении ""Меджлиса"" прогремел взрыв.

 http://www.vesti.ru/doc.html?id=2717430 ",Херсон; Меджлис; Взрыв; Украина,Mejlis; Kherson; Explosion,ukraine; kherson regional council; explosion; bomb; injuries; damage,Kherson; Explosion; Mosque; Mediation Council,explosion; Kherson; Medjlis; Crimea; security; Tatar community
ВЕСТИ_7356,"Атака на русский язык.

 В Херсоне украинские националисты напали на главу Русской национальной общины ""Русичъ"", учителя русского языка Татьяну Кузьмич. Радикалы облили женщину красной краской.

В сентябре Татьяну обвинили в распространении сепаратистских настроений среди школьников, а в СБУ назвали ""агентом Кремля"", который развернул шпионскую сеть.",Ukraine; Russia; Kherson; Russian Language; Separatism; SBU; Red Paint; Tatiana Kuzmich; Rusich,Russian Language Teacher; Attack; Ukraine; Nationalism,Russia; Ukraine; Nationalism; Language; Education,Ukraine; Russian language; nationalism; violence,Kherson; Ukrainian nationalists; Russian National Community; Tatiana Kuzmich; separatism; SBU; spy allegations
ВЕСТИ_11175,"Его звали Джигурда: СБУ заявила о разоблачении .

Якобы агента ФСБ России по прозвищу Джигурда задержала в Херсонской области Служба безопасности Украины. По их мнению, задержанный работает не только в российском ведомстве, но и на Министерство госбезопасности самопровозглашенной ЛНР. 

В январе 2021 года ему якобы были выплачены деньги за протестные мероприятия на Украине и поручено спровоцировать тарифный майдан.",Ukraine; Russia; FSB; SBU; LPR; Intelligence; Conflict; Disinformation,Ukraine; Security Services; Protests; Jigurda,Russia; Ukraine; SBU; Jigurdha,Dmytro Yarosh; Jaguar; FSB agent; Russian FSB; Donetsk People’s Republic; SBU; Kherson Region,FSB; SBU; Dzhigurda; Kherson Oblast; Ukraine; Russia; Luhansk People's Republic; protest activities
ВЕСТИ_20255,"ФСБ: взрыв газопровода в Крыму, совершенный 23 августа, организован Украиной.

 ФСБ подтвердила факт задержания и арест Наримана Джелялова – зампреда ""Меджлиса крымско-татарского народа"" (запрещен в России) в связи с подрывом участка газопровода в Крыму в августе.

4 сентября  задержаны  посредник Нариман Джелялов и непосредственные исполнители диверсии Асан и Азиз Ахтемовы. В июне текущего года Ахтемовы прошли в Херсоне подготовку по взрывному делу. Известно, что за совершение диверсии военная разведка Украины обещала им денежное вознаграждение около 2000 долларов США. Взрывное устройство конспиративным путем за месяц до диверсии было доставлено в Крым. Акцию планировалось приурочить ко дню независимости Украины.

 @vestiru24 ",FSB; Ukraine; Crimea; Gas Pipeline; Explosion; Mejlis; Military Intelligence; Crimean Tatars,FSB; Crimea; Gas Pipeline Explosion; Ukraine; Nariman Jelalov,Russia; Ukraine; Crimea; Gas Pipeline Explosion; FSB; Arrests; Nariman Jelavov; Asan Ahtemov; Aziz Ahtemov,Russia; Ukraine; Crimea; Gas Pipeline Explosion; Nariman Jeljalov,FSB; Crimea; gas pipeline explosion; Ukraine; Nariman Dzhelyalov; Mejlis of the Crimean Tatar People; Asan Akhtemov; Aziz Akhtemov; sabotage; military intelligence
ВЕСТИ_27091,"В Крыму восстановлена подача воды по Северо-Крымскому каналу.  Он был перекрыт Украиной в 2014 году после воссоединения Крыма с Россией. Вода из Херсонской области обеспечивала до 90% потребностей полуострова.

 Все новости о ситуации на Украине
 @vestiru24 ",Крым; Северо-Крымский канал; Украина; Вода; Восстановление; Херсонская область,Crimea; Water Supply; North Crimean Canal; Ukraine-Russia Relations,NA,NA,Crimea; North Crimean Canal; Ukraine-Russia relations; water supply; Kherson region
ВЕСТИ_27703,"Мародеры разграбили супермаркеты в Херсоне и Мелитополе.  Участников грабежей и последствия их действий снимали на видео местные жители.  

 Смотрим все новости о ситуации на Украине
 @vestiru24 ",Ukraine; Kherson; Melitopol; supermarkets; looting; crime; war,Ukraine War; Occupation; Looting; Kherson; Melitopol,Ukraine; Kherson; Melitopol; armed robbery; supermarkets; local footage; video recording,Ukraine; Crime; Looting; Supermarket attack,Ukraine; Kherson; Melitopole; Robbery; Supermarkets; Local News
ВЕСТИ_28143,"Наталья Поклонская совместно с Росгвардией доставила продукты питания и лекарства в Херсонскую область Украины.  По ее словам, из-за отсутствия продуктов первой необходимости и жизненно важных медикаментов люди находятся на грани гуманитарной катастрофы. Также Поклонская обратила внимание на то, что украинские националисты запугивают местное население, если те принимают гуманитарную помощь от России.

 Смотрим подробности
 @vestiru24 ",Natalya Poklonskaya; Russian National Guard; Kherson Region; Ukraine; Humanitarian Aid; Ukrainian Nationalists,Natalia Poklonskaya; Russia-Ukraine conflict; humanitarian aid; Kherson Region,NA,Natalia Poklonskaya; Russia-Ukraine War; humanitarian crisis in Ukraine,Natalya Poklonskaya; Rosgvardiya; humanitarian aid; Kherson region; Ukraine; food and medicine delivery; humanitarian crisis; Russian-Ukrainian relations
ВЕСТИ_29116,"Транспортные и железнодорожные магистрали между Крымом и Херсонской областью будут восстановлены в самое ближайшее время , сообщил заместитель представителя президента РФ в Южном федеральном округе Кирилл Степанов. Он напомнил: ранее, до воссоединения с Россией, полуостров Крым и материк связывали автомобильные и железнодорожные пути, которые пролегали по узкому перешейку на севере Крыма. В 2015 году власти Украины ввели запрет на все железнодорожные перевозки, таким образом попытавшись заблокировать транспортное сообщение с полуостровом. 

Железнодорожная ветка, связавшая Крым с Херсоном, уже используется, рассказал Степанов. По ней жителям Херсона везут гуманитарную помощь и стройматериалы.

 Смотрим подробности
 @vestiru24 ",Crimea; Kherson Oblast; Transport; Railways; Russia; Ukraine; Humanitarian Aid,Crimea; Kherson Region; Transport Links; Railway Restoration,Russia; Ukraine; Crimea; Zaporizhzhia; Railway Link; Kremlin; Annexation; Transportation; Infrastructure; Reconstruction; Humanitarian Aid; Strategic Importance,Crimea; Ukraine; Transport connections; Railway links,Crimea; Kherson Region; Transport Restoration; Railway Routes; Russia-Ukraine Relations
ВЕСТИ_30214,"В распоряжение российских силовых ведомств в Херсоне попали оперативные документы СБУ.  Помечены они грифом ""совершенно секретно"". В них идет речь о работе силовиков с представителями Украинской православной церкви Московского патриархата, а также казачьих общин, которые определили как пророссийские. Согласно документам, украинская спецслужба считала опасными православные праздники. В некоторых бумагах также говорится о работе СБУ с агентурой в Херсоне, включая псевдонимы сотрудников. Содержатся в документах имена, фамилии и должности сотрудников украинской спецслужбы.

 Смотрим подробности
 @vestiru24 ",Russia; Ukraine; SBU; Kherson; Orthodox Church; Cossacks; Intelligence; Security; Conflict,Ukraine-Russia Conflict; Security Services; Occupied Territories; SBU Documents,NA,Russia; Ukraine; SBU; Secret Documents,Ukraine; Russia; Security Services; SBU Documents; Kherson; Orthodox Church; Cossack Communities; Espionage
ВЕСТИ_31011,"📺 В Херсоне заработали все российские федеральные телеканалы.  Речь идет о каналах первого и второго мультиплекса Российской телевизионной и радиовещательной сети. В первый пакет цифровых входят, в частности,  ""Россия 1"" , ""Россия 24"" и  ""Культура"" . Кроме того, жителям города стало доступно радио  ""Вести ФМ"" .

 Смотрим подробности
 @vestiru24 ",Kherson; Russia; TV; Radio; Vesti FM; Russia 1; Russia 24; Kultura,Russian TV; Kherson; Broadcasting,Russia; TV Channels; Herson; Ukraine,Kherson; TV channels; Russia TV Network,Kherson; Russian TV Channels; Digital Broadcasting; Multiplex; Russia 1; Russia 24; Culture; Vesti FM
ВЕСТИ_31410,"Херсонская область Украины с 1 мая переходит в рублевую зону, сообщил зампред военно-гражданской администрации региона Кирилл Стремоусов.  По его словам, переходной период займет до четырех месяцев. В этот срок в регионе будут ходить рубль и гривна. Затем он полностью перейдет на расчеты в рублях, подчеркнул Стремоусов.

 Смотрим подробности
 @vestiru24 ",Ukraine; Kherson; Ruble; Currency; Economy; Russia; Conflict,Kherson Region; Ruble Zone; Currency Transition; Military-Civilian Administration,NA,Ukraine; Kherson Oblast; Ruble zone,Ukraine; Kherson Region; Ruble Zone; Currency Transition; Economic Policy
ВЕСТИ_31649,"Украина демонстративно отказалась от жителей Херсонской области, отключив им мобильную связь, заявил советник главы Крыма по информационной политике Олег Крючков. Он предположил, что следующим шагом станет отказ украинских властей выплачивать пенсии и пособии жителям Херсонской области, а также исполнять банковские обязательства в этом регионе. 

 Смотрим подробности
 @vestiru24 ",Ukraine; Russia; Crimea; Kherson; Mobile Communication; Pensions; Benefits; Banking,Ukraine; Kherson Region; Mobile Network Shutdown; Russian Occupation; Oleg Kryuchkov,Ukraine; Kherson Region; Crimea; Citizenship; Rights and Freedoms,Ukraine; Kherson Region; Mobile Communication Cut Off,Ukraine; Kherson region; mobile communication; Oleg Kruchkov; pension payments; banking obligations
ВЕСТИ_31979,"""Россия здесь навсегда, в этом не должно быть никаких сомнений, будем жить вместе"" : вице-спикер Совфеда РФ Андрей Турчак - жителям Херсонской области в ходе рабочей поездки в область.  

 @vestiru24 ",Russia; Kherson region; Andrey Turchak; Federation Council; political statement,Russia; Ukraine; Kherson Region; Andrei Turchak; Federation Council,Russia; Crimea; Ukraine; Politics,Russia; Kherson region; Vice Speaker Andrey Turchak,Russia; Kherson Oblast; Andrey Turchak; Federation Council; working trip; political statement
ВЕСТИ_31993,"❗️В Херсоне задержан мужчина, готовивший теракт 9 мая, сообщают в СК РФ.  В ведомстве рассказали, что задержанный планировал осуществить свои планы во время праздничных мероприятий в честь Дня Победы. В его квартире найдена лаборатория по изготовлению СВУ. Подозреваемый сообщил, что действовал под давлением украинской территориальной обороны.

 @vestiru24 ",Херсон; терроризм; 9 мая; СВУ; СК РФ; Украина; территориальная оборона,Terrorism; Explosives; Victory Day; Kherson; Russian Investigative Committee,Russia; Ukraine; Terrorism; Investigative Committee; Kherson,terrorism; Russia-Ukraine conflict,Kherson; arrest; terrorist attack; Victory Day; improvised explosive devices; Ukrainian territorial defense
ВЕСТИ_32023,"Херсонская область будет стремиться стать одним из субъектов Российской Федерации, рассказал заместитель председателя военно-гражданской администрации региона Кирилл Стремоусов.  В случае необходимости власти региона готовы обратиться к правительству России касательно включения Херсонской области в состав РФ. Однако уже сейчас регион полноценно сотрудничает с Россией и чувствует себя как единое целое с другими регионами РФ, заметил он.

 Смотрим подробности
 @vestiru24 ",Херсонская область; Россия; Субъект РФ; Военно-гражданская администрация; Власти,Herson Region; Russian Federation; Kirill Stremoysov; Military-Civilian Administration,NA,Kherson; Ukraine,Kherson Region; Russian Federation; Kirill Stremousov; Military-Civilian Administration; Integration
ВЕСТИ_32311,"❗️ Власти Херсонской области обратятся к президенту РФ с просьбой включить регион в состав России.  Об этом сообщили в военно-гражданской администрации области.

 @vestiru24 ",Ukraine; Russia; Kherson; Politics; Conflict,Ukraine-Russia Conflict; Occupied Territories; Herson Region; Russian Annexation; International Relations,Russia; annexation; Ukraine; Herson Region,Kherson region; Russia,Russia; Ukraine; Annexation; Kherson Region
ВЕСТИ_32315,"❗️ Банки Херсонской области интегрируют в банковскую систему РФ .
▪️Структура власти в Херсонской области будет выстраиваться по аналогии с российскими регионами.
▪️До конца года регион подготовит законодательную базу для вхождения в РФ в виде субъекта, решение будет принято тогда же.
▪️В Херсонскую область направят учителей из Крыма, чтобы подготовить педагогов к проведению уроков по российскому стандарту.

 @vestiru24 ",Ukraine; Russia; Kherson; Politics; Integration; Banking; Education,Kherson Region; Integration; Russian Banking System; Educational Standards,Russia; Ukraine; Herson Region; Banking System; Integration,Herson Region; Russia Integration,Herson Oblast; Russian banking system; regional governance; legislative preparation; education standards; Crimea
ВЕСТИ_32318,"Песков о возможности присоединения Херсонской области   к России:   ""Безусловно, быть или не быть такому обращению , должны решать все-таки жители Херсонской области – это первое. И определять свою судьбу тоже должны жители Херсонской области"" . Пресс-секретарь президент РФ добавил, что этот вопрос ""должен быть четко и тщательно выверен и оценен юристами и правовиками"".

 @vestiru24 ",Russia; Ukraine; Kherson; Peskov; Annexation; Legal Assessment,Russia; Kherson Region; Dmitry Peskov; Joining; Legal Evaluation,Russia; Kherson Region; Annexation; Presidential Press Secretary,Russia; Ukraine; Crimea; Sevastopol; annexation,Russia; Kherson Region; Annexation; Legal Assessment; Public Opinion
ВЕСТИ_32354,"Подборка самых важных и актуальных новостей этого дня:

➡️ В России начали выплачивать новое пособие на детей

 ➡️ Неприятие переписывания истории: необъятное поле цветов в Риге

 ➡️ В Калининграде предотвратили теракт 9 мая

 ➡️ Песков прокомментировал ситуацию с транзитом газа через Украину

 ➡️ ""Никаких ХНР"": Херсонская область хочет войти в состав России

 @smotrim_ru ",Russia; Ukraine; Politics; Security; History; International Relations,Russia; Child Allowance; Riga Protests; Terror Plot; Gas Transit,Russia; Economy; Child Allowance; Inflation; Food Prices,news; Russia; Latvia; Kaliningrad,Russia; child benefit; Riga; history; Kaliningrad; terrorism prevention; gas transit; Ukraine; Kherson; political developments
ВЕСТИ_32403,"Валентина Матвиенко заявила, что Россия согласится с любым решением, которое примут жители Херсонской области относительно будущего статуса своей территории.

▪️Спикер Совфеда также прокомментировала возможный снос памятника в Риге. "" Символом европейской демократии стал бульдозер "", – заявила Матвиенко. 

 @vestiru24 ",Russia; Kherson; Riga; Democracy; Politics,Russia; Kherson Region; Valentina Matviyenko; Future Territory Status; Political Decisions,Valentina Matviyenko; Russia; Kherson region; Crimea; demolition of a monument in Riga,Valentina Matviyenko; Russia; Kherson Region; European Democracy; Riga Monument Demolition,Valentina Matvienko; Kherson Region; Russia; European Democracy; Monument in Riga
ВЕСТИ_32546,"Глава ДНР Денис Пушилин снял пятилетний запрет на ввоз товаров из Харьковской, Херсонской и Запорожской областей.  Теперь резидентам ДНР и ЛНР разрешено заключать внешнеэкономические сделки без таможенных процедур с нерезидентами трех областей. 

 Смотрим подробности
 @vestiru24 ",DNR; LNR; Denis Pushilin; trade; Kharkiv; Kherson; Zaporizhzhia,Denis Pushilin; Donetsk People's Republic; Lifted Ban; Kharkiv Region; Kherson Region; Zaporizhzhia Region; External Economic Transactions,NA,Donetsk People’s Republic; Denis Pushilin; Five-Year Ban Lifted on Imports,DPR; Denis Pushilin; trade ban lifted; Kharkiv region; Kherson region; Zaporizhzhia region; foreign economic activity; customs procedures
ВЕСТИ_32605,"Херсонские предприниматели начали вставать на учет в отделениях Федеральной налоговой службы в Крыму.  Одновременно бизнесмены открывают счета в банках полуострова, что позволяет им ускорить взаиморасчеты и законно торговать в России. Об этом сообщил представитель Крыма при президенте РФ Георгий Мурадов. Речь идет о предпринимателях, которые выращивают и продают сельхозпродукцию – из Херсонской области она уже поступает в Крым, южные регионы России и Москву.

 Смотрим подробности
 @vestiru24 ",Herson; Crimea; Russia; Business; Trade; Agriculture; Economy,Herson Entrepreneurs; Russian Tax Offices; Bank Accounts; Agricultural Production; Crimea; Southern Regions,Russia; Crimea; Herson; Entrepreneurship; Economy; Trade; Banking; Taxation,Kherson region; Ukraine; Russia; Crimea; Federal Tax Service; SWIFT system,Kherson; Crimea; Tax Registration; Agriculture; Business; Russia
ВЕСТИ_32618,"Предприниматели из Херсонской области,занимающиеся реализацией сельскохозяйственной продукции, начали оформлять документы в отделениях ФНС и банках в Крыму. Об этом сообщил постпред Крыма при президенте РФ Георгий Мурадов. 

 @vestiru24 ",Херсон; Крым; сельское хозяйство; ФНС; предприниматели; торговля,Kherson Region; Entrepreneurs; Tax Registration; Banks; Georgy Muradov; Crimea,Ukraine; Kherson Region; Crimea; Entrepreneurs; Agricultural Products; Registration; Documents; FNS; Banking; Economy; Business; Postpred Kryma pri prezidente RF Georgiy Muradov,Kherson Region; Agricultural Produce; Registration Documents; Tax Office; Bank; Crimea; Georgy Muradov,Kherson Region; Crimea; Agricultural Products; Document Processing; Tax Offices; Banks; Georgy Muradov
ВЕСТИ_32738,"❗️Россия будет заниматься восстановлением и ремонтом дорог и мостов в Херсонской области, деньги на это выделены

 Хуснуллин",Russia; Kherson Oblast; Roads; Bridges; Restoration; Repair; Infrastructure,Infrastructure; Reconstruction; Kherson Region; Russian Investment,Kherson Region; Russia; Ukraine; Infrastructure Development; Roads and Bridges,Kherson Oblast ; Infrastructure,Russia; Kherson region; infrastructure; road repair; bridge maintenance; funding
ВЕСТИ_32838,"❗️ Глава Крыма Аксенов заявил, что видит будущее Херсонской и Запорожской областей вместе с Крымом в границах одного государства. 

 @vestiru24 ",Crimea; Kherson; Zaporizhzhia; Russia; Politics; Aksyonov,Ukraine; Crimea; Kherson Region; Zaporizhzhia Region; Sergey Aksyonov; Russian Annexation,Russia; Ukraine; Crimea; Kherson; Zaporizhzhia; Germany,Crimea; Aksenov; Kherson region; Zaporizhzhia region,Crimea; Sergey Aksyonov; Kherson; Zaporizhzhia; Ukraine; Russia; Geopolitical Tensions; Territorial Disputes
