doc_id,text,gemma3,owl/t-lite,llama3.2,phi4-mini,phi4
ВЕСТИ_54899,"⚡️ ⚡️ ⚡️ ⚡️ Германия ищет себе новые проблемы, причем долгосрочного характера,  заявил председатель Госдумы Вячеслав Володин в своем Telegram-канале.  ""Сегодня немецкое правительство решило переложить проблемы, которые создали их предшественники, на нашу страну. С этой целью планируют изъять российские активы для восстановления Украины. Как только такое решение состоится, мы имеем право на аналогичные действия в отношении активов Германии и других государств"" , - подчеркнул он. Также Володин добавил, что у стран, признавших независимость Косово, ""нет другого выхода, как согласиться с правом"" Южной Осетии, Абхазии, Крыма, Донецкой и Луганской народных республик, а также Херсонской и Запорожской областей на самоопределение.  ""Это положит начало процессу, когда все государства станут игнорировать международное право, по своему усмотрению забирать, что посчитают нужным"" , - резюмировал он.

 @vestiru24 ",Russia; Germany; Ukraine; International Law; Asset Seizure; Conflict; Politics,Russia; Germany; Asset Freeze; Ukraine Reconstruction; International Law,Russia; Germany; Kosovo; South Ossetia; Abkhazia; Crimea; Donetsk; Luhansk; Kherson; Zaporizhzhia; Vladimir Volodin,Russia; Germany; Ukraine; Kosovo; International Affairs,Germany; Russia; Vladimir Volodin; State Duma; Telegram; International Law; Kosovo; South Ossetia; Abkhazia; Crimea; Donetsk and Luhansk People's Republics; Kherson Region; Zaporizhzhia Region
ВЕСТИ_55383,"Воздушная тревога объявлена в Николаевской и Одесской областях, а также в Херсоне.

 @vestiru24 ",air raid alert; Mykolaiv; Odesa; Kherson,air alert; Ukraine; Nikolaevskaia region; Odesskaia region; Kherson,Ukraine; air raid alert; Nikolaev; Odessa; Kherson,air alert; Nikolaev; Odessa; Kherson,air alert; Nikolaev region; Odessa region; Kherson; Ukraine
ВЕСТИ_55543,"Татьяна Голикова: с 1 января 2023 года в ДНР и ЛНР средний прожиточный минимум составит 11200 рублей, в Херсонской и Запорожской областях – 11644 рублей ориентировочно.

 📍На территориях новых регионов не должно быть сотрудников бюджетной сферы с зарплатой ниже МРОТ.
📍В новых регионах РФ начал работу социальный фонд, он будет осуществлять все положенные выплаты.

 @vestiru24 ",ДНР; ЛНР; Херсон; Запорожье; прожиточный минимум; МРОТ; социальный фонд; Голикова; Татiана Голикова,Russia; Donetsk People's Republic; Luhansk People's Republic; Herson Oblast; Zaporizhzhia Oblast; Minimum Wage; Social Fund,NA,TRUE; TRUE,Russia; subsistence minimum; wage policy; social fund; DNR; LNR; Kherson region; Zaporizhzhia region
ВЕСТИ_56344,"Взрывы прогремели в Херсоне.  Об этом сообщают украинские СМИ.

 Подпишись на ВЕСТИ ",Ukraine; Kherson; Conflict; Explosions,Kherson; Explosion; Ukraine,ukraine; kherson; explosions; russia; conflict; news,Kherson; explosion; Ukraine,Kherson; explosions; Ukraine; news
ВЕСТИ_56600,"Воздушная тревога объявлена в Днепропетровской, Полтавской областях Украины и подконтрольной Киеву части Херсонской области. Об этом свидетельствуют данные официального ресурса оповещения граждан.

 Подпишись на ВЕСТИ ",Ukraine; Air raid alert; Dnipro; Poltava; Kherson,air alert; Ukraine; Dnipro; Poltava; Kherson,ukraine; air raid alert; dnipropetrovsk; poltava; kherson region; kyiv control,Ukraine; Air alert; Dnipropetrovsk; Poltava regions; Kherson region,Ukraine; Air Alert; Dnipropetrovsk Region; Poltava Region; Kherson Region; Public Notification
ВЕСТИ_56920,"Глав Днепропетровской, Киевской, Сумской, а также подконтрольных Украине частей Запорожской и Херсонской областей уволил Зеленский.  Это следует из указа. 

Кроме того, заместителем главы офиса президента назначен экс-глава Киевской областной администрации Алексей Кулеба.

 Подпишись на ВЕСТИ ",Зеленский; Украина; Запорожская область; Херсонская область; Зеленский; Кулеба,Ukraine; Zelensky; Dismissal; Regional Leaders,NA,Ukraine; Dmytro Firtas; Alexey Kuleba; President Volodymyr Zelensky,Ukraine; Volodymyr Zelensky; Regional Governance; Political Appointments
ВЕСТИ_57212,"Военно-гражданская администрация Херсонской области переименована в   областную администрацию . Во главе исполнительной власти стоит губернатор, сообщил врио главы региона Владимир Сальдо.  ""Мы переходим на мирные рельсы и начинаем налаживать мирную жизнь в нашем регионе, и это отражается в названии государственных структур"" , - написал он в своем Telegram-канале.

 Подпишись на ВЕСТИ ",Херсон; администрация; переименование; Владимир Сальдо,Military-Civil Administration; Kherson Region; Regional Administration; Peaceful Life,ukraine; herson region; regional administration,Kherson; administration; Ukraine,Herson Oblast; Vladimir Saldo; civil administration; governor; peaceful transition
ВЕСТИ_57239,"Жители ДНР, ЛНР, Херсонской и Запорожской областей смогут в полной мере воспользоваться мерами социальной поддержки, действующими в РФ.  В Минтруда сообщили, что для этого разработан пакет законопроектов, которые устанавливают особенности переходного периода в социальной сфере на этих территориях. Новые законопроекты регламентируют:
📌 назначение пенсий, выплат по обязательному социальному страхованию и мер социальной поддержки;
📌порядок установления прожиточного минимума;
📌порядок установления стажа для назначения пенсий в случае, если документы утрачены;
📌порядок расчета среднего заработка для начисления пособий по временной нетрудоспособности в 2023 и 2024 годах;
📌порядок перехода на действующие в РФ меры поддержки для тех, кто сейчас получает выплаты по прежнему законодательству.

 ""С 1 марта пенсионное обеспечение граждан будет осуществляться по российскому законодательству с учетом предлагаемых особенностей"",  - сообщил министр труда и социальной защиты РФ Антон Котяков. Жителям новых регионов будут доступны все виды пенсий, действующих в России: страховые пенсии по старости, по потере кормильца, по инвалидности, социальные пенсии.

 Подпишись на ВЕСТИ ",ДНР; ЛНР; Херсонская область; Запорожская область; социальная поддержка; пенсии; Россия; законопроекты,Social Support; Pensions; Russian Legislation; Donbas; Luhansk People's Republic; Southern Ukraine,,Donetsk People's Republic; Luhansk People's Republic; Kherson region; Zaporizhzhia region,Russia; social support measures; Donetsk People's Republic; Luhansk People's Republic; Kherson region; Zaporizhzhia region; pension provision; legislative proposals; subsistence minimum; temporary disability benefits
ВЕСТИ_57249,"Кабмин внес в Думу проекты базовых законов об особенностях пенсионного и социального обеспечения в ДНР и ЛНР, а также в Херсонской и Запорожской областях.  Так, в одной из инициатив предлагается с 1 марта 2023 года выплачивать пенсии и дополнительное социальное обеспечение в соответствии с законодательством Российской Федерации.

 Подпишись на ВЕСТИ ",Russia; Ukraine; Donetsk; Luhansk; Kherson; Zaporizhzhia; Pension; Social Security; Politics,Russian Government; State Duma; Donetsk People's Republic; Luhansk People's Republic; Kherson Region; Zaporizhzhia Region; Pension Reforms; Social Security; Ukraine,"Ukraine; Donbas; Luhansk; Crimea; pension; social security; Russian law; March 1, 2023",Cabmin; Pension Legislation; Social Security Law; DPR; LPR; Kherson Region; Zaporizhzhia Oblast,Ukraine; Russia; pension reform; social security; Donetsk People's Republic; Luhansk People's Republic; Kherson region; Zaporizhzhia region
ВЕСТИ_57453,"Воздушная тревога объявлена в Одесской, Николаевской, Кировоградской областях Украины и подконтрольной Киеву части Херсонской области. 

 Подпишись на ВЕСТИ ",Ukraine; Air raid alert; Odessa; Mykolaiv; Kirovohrad; Kherson,Ukraine; Air Alert; Odessa; Nikolaev; Kirovohrad; Kherson,ukraine; air raid alert; odessa; mykolaiv; kirovohrad; kherson region; kyiv's control,Ukraine; Odessa; Mykolaiv; Kirovohrad region; Kherson Oblast; air alarm,Ukraine; Air Alert; Odessa Region; Mykolaiv Region; Kirovohrad Region; Kherson Region
ВЕСТИ_58947,"До 1 июля запрещается вывоз зерновых из Херсонской области без разрешения Минсельхоза региона, сообщил врио губернатора области Владимир Сальдо. 

Он уточнил, что форма разрешительной документации должна быть разработана к 10 февраля.",Ukraine; Kherson Oblast; Grain Export; Ministry of Agriculture; Restrictions; Agriculture,grain export; Kherson Oblast; regional restrictions,ukraine; kherson region; export of grains; ministry of agriculture,Kherson; grain ban; export,Kherson Region; Grain Export Ban; Vladimir Saldo; Ministry of Agriculture; Authorization Documents
ВЕСТИ_58974,"Услуга по приему и учету уведомлений о начале предпринимательской деятельности стала доступна жителям ЛНР, ДНР, Запорожской и Херсонской областей — Роспотребнадзор.",Rospotrebnadzor; LPR; DPR; Zaporizhzhia Oblast; Kherson Oblast; Entrepreneurship; Notification; Consumer Rights Protection,Entrepreneurship; Registration; LPR; DPR; Zaporizhzhia Region; Kherson Region; Rospotrebnadzor,Rospotrebnadzor; LNR; DNR; Zaporizhzhia region; Kherson region; entrepreneurial activity; notification; service,Donetsk People's Republic; LNR; DPR; Zaporizhzhia region; Kherson region,Rospotrebnadzor; entrepreneurial activity; registration service; LNR; DNR; Zaporizhzhia region; Kherson region
ВЕСТИ_59345,"⚡️  Российские стандарты социальной защиты в новых регионах должны начать действовать с 1 марта, заявил Вячеслав Володин. 

 ""За 30 лет от так и не состоявшегося украинского государства люди не смогли получить достаточные социальные гарантии"" , - написал он в своем Telegram-канале.

Володин подчеркнул, что граждане из ЛНР, ДНР, Запорожской и Херсонской областей должны чувствовать себя защищенными так же, как и в других регионах РФ.",Russia; Social Protection; Ukraine; LNR; DNR; Zaporizhzhia; Kherson,Russia; Social Protection; New Regions,Russia; Vladimir Putin; Social Protection; New Regions,Russia; social protection,Russia; social protection standards; Vladimir Vasilyevich Volodin; LNR; DNR; Zaporozhye; Kherson; Ukraine
ВЕСТИ_59758,"⏫ ⏫ ⏫ ⏫ ⏫  ""В Запорожской области, как и в Донбассе, и в Херсонской области, несмотря на все сложности, уже сейчас идет работа по восстановлению социальной сферы, в том числе системы здравоохранения"", - заявил Владимир Путин во время открытия новых объектов здравоохранения.

Президент поручил Минздраву и впредь уделять решению этой задачи особое внимание.",Vladimir Putin; Russia; Healthcare; Social Sphere; Zaporizhzhya; Donbas; Kherson; Restoration; Ministry of Health,Healthcare; Infrastructure Development; Reconstruction; Ukraine; Vladimir Putin,Russia; Ukraine; Vladimir Putin; Healthcare System,Healthcare; Reconstruction in Ukraine; Presidential Address,Ukraine; Reconstruction; Social Sphere; Healthcare System; Vladimir Putin; Zaporizhzhia; Donbas; Kherson
ВЕСТИ_59785,"Полицейский, несущий службу в зоне проведения СВО, впервые за 25 лет оказался у родного крыльца. 

Дом он покинул еще будучи ребенком – вся семья переехала в Сибирь из Херсонской области. Офицер поделился теплыми детскими воспоминаниями.",police; SVO; conflict zone; return; memories; Kherson; Siberia; family; childhood,Homecoming; Memories; Police Officer; Conflict Zone,Russia; Police Officer; Birthplace; Childhood Memories; SWO; Siberia; Hersonskiy Oblast; Ukraine,homecoming; police work; Russia; Ukraine; Southeast Ukraine; conflict zone,police; homecoming; childhood memories; Kherson Oblast; Siberia
ВЕСТИ_60195,"Воздушная тревога объявлена в Харьковской, Днепропетровской, Николаевской, Одесской областях Украины, а также на территории Запорожской и Херсонской областей.",Ukraine; Air raid alert; Kharkiv; Dnipropetrovsk; Mykolaiv; Odesa; Zaporizhzhia; Kherson,air raid; alert; Ukraine; Kharkivska; Dnipropetrovsk; Nikolaevska; Odessa; Zaporizhzhia; Kherson,NA,air alarm; Kharkiv region; Dnipropetrovsk region; Mykolaiv region; Odessa region; Zaporizhzhia Oblast; Kherson Oblast,Ukraine; Air Raid Alert; Security Measures; Regional Safety
ВЕСТИ_60321,Рособрнадзор: ЕГЭ в 2023 году не будут сдавать только в Херсонской области.,EGE; Unified State Exam; Rosobrnadzor; Ukraine; Kherson Region; Education; Conflict,Education; Testing; Kherson,Ukraine; Unified State Exam (EGE); Kherson region,Rosobrnadzor; Unified State Examination (EGE); 2023,Unified State Exam; Kherson Region; Rosobrnadzor; Ukraine; Education; 2023
