doc_id,text,gemma3,owl/t-lite,llama3.2,phi4-mini,phi4
ВЕСТИ_78978,"Совет Федерации одобрил закон, направленный на запрет деятельности коллекторов на территориях ДНР, ЛНР, Запорожской и Херсонской областей в течение переходного периода - до 1 января 2026 года.",Russia; Ukraine; Territories; Collectors; Law; Donetsk; Luhansk; Zaporizhzhia; Kherson; Transition Period,Federal Council; Donbas Conflict; Ukraine; Debt Collection; Legal Measures,NA,Ukraine; Law; Debt Collection Ban,Russian Federation; Federation Council; Debt Collectors Ban; DNR; LNR; Zaporizhzhia Region; Kherson Region; 2026
ВЕСТИ_79093,Суд в Ростове приговорил к 23 и 24 годам колонии обвиняемых в покушении на первого замглавы администрации Херсонской области в декабре 2022.,Ростов; суд; покушение; Херсонская область; замглавы администрации; колония; 2022,Rostov Court; Sentencing; Assassination Attempt; Kherson Administration; Ukraine Conflict,Russia; Ukraine; Kherson Region; Attempted Assassination; Prison Sentences,court; Rostov; Kherson region; attempted murder; first deputy head,Rostov-on-Don; Kherson Oblast; assassination attempt; Ukraine; court ruling; security
ВЕСТИ_79211,Число погибших при разрушении Каховской ГЭС в Херсонской области увеличилось до 55. Об этом сообщил РИА Новости представитель экстренных служб.,Kakhovka Dam; Kherson Region; Russia; Ukraine; Disaster; Casualties,Collapse; Casualties; Kakhovka Hydroelectric Power Plant; Kherson Region,NA,Chernobyl Exclusion Zone; Zaporizhzhia Nuclear Power Plant; Kakhovskaya GES; Ukraine Flooding Disaster,Kahovka Hydroelectric Power Station; Kherson Region; Disaster; Emergency Services; RIA Novosti
ВЕСТИ_79596,"Путин подписал закон, запрещающий до 2026 года взыскивать просроченные долги с жителей ДНР, ЛНР, Херсонской и Запорожской областей по кредитам и займам, взятым в банках или микрофинансовых организациях.",Russia; Ukraine; Debt; Donetsk; Luhansk; Kherson; Zaporizhzhia; Finance; Law; Debt Collection,Debt Collection; Donbas; Luhansk; Kherson; Zaporizhzhia; Putin's Law; Financial Protection,Russia; Ukraine; Donbass; Luhansk; Kherson; Zaporizhzhia,Putin; Russia; Donetsk People’s Republic; Luhansk People's Republic; Kherson region; Zaporizhzhia Oblast; debt collection ban,Russia; Vladimir Putin; Debt Moratorium; Donetsk People's Republic; Luhansk People's Republic; Kherson Region; Zaporizhzhia Region; Ukraine
ВЕСТИ_80216,"Российские власти выплатили около 150 миллионов рублей 15 тысячам пострадавших из-за затопления после разрушения украинскими войсками Каховской ГЭС.

Об этом сообщил в своем Telegram-канале председатель правительства Херсонской области Андрей Алексеенко.",Russia; Ukraine; Kakhovka Dam; Flood; Humanitarian Aid; Conflict; Herson Oblast,Russia; Kherson Oblast; Kakhovka Hydroelectric Station; Floods; Aid,Russia; Ukraine; floods; Kakhovka Hydroelectric Power Plant,Russia; Ukraine conflict; Khakhaivsk Hydroelectric Power Station; flooding; damaged property compensation,Russia; Ukraine; Kakhovka Dam; compensation; flood victims; Andrey Aleykin
ВЕСТИ_80391,Сальдо: на административной границе Херсонской области с Крымом примут меры для ускорения досмотра людей и машин.,Kherson region; Crimea; border control; inspection; administrative border,Administrative Border; Kherson Region; Crimea; Security Measures; Customs Control,NA,border control; administrative boundary; Kherson region; Crimea; security measures; inspection acceleration,Kherson Region; Crimea; Administrative Border; Security Measures; Transportation
ВЕСТИ_80418,"🚧  Пункты пропуска из Херсонской области в Крым работают в штатном режиме

 Очередей на выезд из полуострова через Херсонскую область нет.

 @vesticrimea ",Ukraine; Crimea; Kherson; Checkpoint; Traffic; News,Crimea; Kherson Region; Ukraine-Russia Border; Crossings,Kherson region; Crimea; border crossing; travel restrictions,Kherson region; Crimea,border crossing; Kherson region; Crimea; travel; traffic
ВЕСТИ_80441,"В Херсонской области образовалась пробка длиной более 5 км на пути автомобилистов, выезжающих из Крыма в сторону Мелитополя.",Kherson region; traffic jam; Crimea; Melitopol; transport,Kherson Oblast; Crimea; Traffic Jam; Road Congestion,Kherson Region; Crimea; Traffic Jam; Transportation Disruptions,traffic; jam; Kherson region; Crimea-Melitopol,traffic jam; Kherson region; Crimea; Melitopol
ВЕСТИ_80526,Аксенов: очередей на пунктах пропуска в Херсонскую область нет.,Kherson Region; Checkpoint; Axenov,Kherson Region; Checkpoints; Travel; Security,"Kherson region; Mikhail Razvozhayev; Ukraine; Russia; checkpoints; queues; press conference; February 20, 2024",border crossing; Kherson Oblast; queue-free,Ukraine; Kherson Region; Checkpoints; Akhmetov
ВЕСТИ_80846,"Каховского водохранилища больше не существует, на его месте остались лишь лужицы, рассказал РИА Новости глава Мелитопольского района Запорожской области Андрей Сигута. 

По его словам, Каховское водохранилище практически полностью высохло, остается немного воды в части водоема в Херсонской области, где расположено устье Северо-Крымского канала. 

Реки Конка и Днепр идут по своим руслам и на месте бывшего водохранилища ""не разливаются"".",Kakhovka Reservoir; Ukraine; Russia; Dnieper River; North Crimean Canal; Water Crisis,Kakhovka Reservoir; Drying Up; Ukraine; Melitopol District,Kakhovka Reservoir; Ukraine; Drought; Water Diversion; Reservoir Restoration,Ukraine; Kakhovsk Reservoir; disappeared; water crisis,Kakhovka Reservoir; drought; water shortage; North Crimean Canal; Melitopol District; Zaporizhzhia Oblast; Kherson Oblast
ВЕСТИ_80930,"В Херсонской области не будет урожая из-за того, что Северо-Крымский и Каховский каналы остались без воды после подрыва Каховской ГЭС. Об этом в эфире канала ""Россия 24"" сообщил врио главы региона Владимир Сальдо.",Kherson Region; Ukraine; Dnieper River; Kakhovka Dam; North Crimean Canal; Harvest,Ukraine; Kherson Region; Water Crisis; Agriculture,Ukraine; Kherson region; Kakhovka HES; Severo-Krymsky canal; Kakhovka canal; hydroelectric power plant; explosion; water shortage; harvest,Kherson Region; Kakhovsk Hydroelectric Station Damaged; Water Shortage Impacting Agriculture,Kherson Region; Agriculture; Water Supply; Kakhovka Dam; North Crimean Canal; Explosion
ВЕСТИ_80938,"После взрыва на Каховской ГЭС и осушения Каховского водохранилища в Херсонской области пострадает урожай, сообщил врио главы региона Владимир Сальдо.

""Не будет такой урожайности, которая была при применении систем мелиорации"", – сказал Сальдо в эфире канала ""Россия 24"".

Впрочем, по его словам, знаменитые местные арбузы и помидоры ""росли на Херсонщине всегда и без Каховского водохранилища"".",Kakhovka Dam; Kherson Oblast; Harvest; Irrigation; Watermelons; Tomatoes,Kakhovka Hydroelectric Plant; Explosion; Drying Reservoir; Ukraine Harvest,Ukraine; Herson Region; Crops; Dam Explosion; Kakhovka Hydroelectric Power Plant; Kakhovka Reservoir,Kakhovsk Reservoir; Agriculture; Flooding; Hydroelectric Station explosion,Kakhovka Dam; explosion; Kherson Oblast; agriculture; irrigation systems; crop yield; watermelons; tomatoes
ВЕСТИ_81198,"👨‍👩‍👦‍👦 Хотите дать ребёнку всё самое лучшее?

 Государство вас в этом активно поддерживает. На второго малыша, рождённого с 1 января 2007 года, а также на первых детей, родившихся с 1 января 2020 года, выплачивается материнский капитал. Рассказываем, как его получить жителям ДНР, ЛНР, Херсонской и Запорожской областей и на что можно потратить.

🏢Чтобы оформить сертификат и распорядиться деньгами, обратитесь в отделение Соцфонда или МФЦ.

Маткапитал можно потратить на:

— образование детей;
— ремонт или выплату по ипотеке;
— накопительную часть пенсии мамы;
— соцадаптацию детей с инвалидностью;
— ежемесячную выплату для детей до трёх лет.

Размер выплаты в 2023 году:

• 586,9 тыс. рублей — на первого ребёнка, рождённого с 1 января 2020 года, или на второго, появившегося до 1 января 2020 года;
• 188,6 тыс. рублей — на второго, если получали выплату на первого;
• 775,6 тыс. рублей — на второго, который родился в 2020 году и позднее, если не получали выплату на первого.

 👉 Читайте также:

 Как оплатить учёбу ребёнка с помощью маткапитала? 

 Как с помощью маткапитала улучшить жилищные условия? 

 Как индексируется материнский капитал? 

 #поддержкасемей  

 Следите за новостями на Объясняем.РФ ",family support; maternal capital; child benefits; Donetsk; Luhansk; Kherson; Zaporizhzhia; Russia,Maternity Capital; Donbas; Luhansk Region; Kherson Oblast; Zaporizhzhia Oblast; Social Fund; Pension Funds; Education; Housing; Childcare,maternity capital; donetsk region; luhansk region; kherson region; zaporizhzhia region; ukraine; benefit; family support; social benefits,maternal capital; government aid,maternity capital; family support; DNR; LNR; Kherson region; Zaporizhzhia region; social benefits; child education; housing improvement; pension savings
ВЕСТИ_81356,"В вузах ЛНР, Запорожской и Херсонской областей с 1 сентября обучение планируется начать очно, в ДНР - удаленно. Об этом сообщил Фальков.",education; Ukraine; Luhansk region; Zaporizhzhya region; Kherson region; Donetsk People's Republic (DPR),Education; Donetsk People's Republic; Ukraine; Remote Learning; On-Campus Education,Ukraine; Education; Luhansk region; Zaporizhzhia region; Kherson region; Donetsk People's Republic; DPR; Online learning; On-campus classes,education; Donetsk People's Republic; Luhansk People's Republic; online learning,education; Luhansk People's Republic; Zaporizhzhia region; Kherson region; Donetsk People's Republic; remote learning; in-person classes
ВЕСТИ_81414,Сальдо: более 30 тысяч жителей Херсонской области купили жилье в регионах РФ с помощью государственных жилищных сертификатов.,Kherson Oblast; Russia; Housing; State Housing Certificates; Migration; Ukraine,Housing; State Support; Ukraine-Russia Conflict,Russia; Kherson region; housing certificates,Kherson region; housing certificates; residential property purchases; Russian regions,Kherson Region; State Housing Certificates; Housing Purchase; Relocation; Russia
ВЕСТИ_81485,"🇷🇺 Жители новых регионов уже получают меры соцподдержки — материнский капитал, пособия по безработице, лечение по ОМС и не только. 

Например, пенсию оформили более 415 тыс. человек из ДНР, ЛНР, Херсонской и Запорожской областей.

В 2024 году для россиян из этих регионов появятся новые возможности:

• введут социальный контракт для семей;
• тем, кто получает ежемесячную денежную выплату, предоставят набор соцуслуг — путёвки в санатории, проезд к месту лечения и бесплатные медикаменты;
• повысят зарплаты учителям, врачам и другим работникам бюджетной сферы. 

Как получить эти услуги, куда обращаться и какие документы нужны, рассказываем в карточках.

 А больше информации о мерах поддержки вы найдёте  здесь .

 #мерыподдержки  

 Следите за новостями на Объясняем.РФ ",social support; new territories; Russia; benefits; healthcare; education,Social Support; New Regions; Benefits,Russia; Social Support; Newly Annexed Regions,Russia; Social Support Measures; Maternal Capital; Unemployment Benefits; Medical Treatment under OAS,social support; Russia; new regions; maternity capital; unemployment benefits; medical treatment; pensions; 2024 opportunities; public sector salaries
ВЕСТИ_82007,"В этом году православные отмечают 1035-летие крещения Руси. Это одно из важнейших таинств, которое напоминает о единстве славянских народов.

""Со скорбью и с болью в сердце мы видим сегодня, что происходит на Украине и что происходит в тех святынях, которые строил святой князь Владимир"", - говорит настоятель Херсонесского собора Сергий Халюта.",Orthodox Christianity; Baptism of Rus'; Ukraine; Vladimir; History; Culture; Religion,Religious History; Unity; Baptism of Kievan Rus; Historical Events,"Orthodox Church; Kievan Rus',; Slavic Nations; Vladimir; Ukraine; Hersonesus; Sergey Khalyuta",Orthodox Church; Rus' Baptism; Prince Vladimir; Ukraine conflict,Orthodox Christianity; Baptism of Rus'; 1035th Anniversary; Slavic Unity; Ukraine; Saint Prince Vladimir; Khersonese Cathedral
ВЕСТИ_82806,"⏫ ⏫ ⏫ ⏫ ⏫  ""Люди снова начали возвращаться [в Новою Каховку]. Они и не уезжали далеко — пострадавшие от подрыва Каховской ГЭС были размещены в Крыму и Краснодарском крае"", — рассказал Владимир Сальдо. 

В интервью телеканалу ""Россия 24"" врио главы Херсонской области напомнил, что в регионе начался сезон сбора урожая. А, по его словам, ""человек всегда ищет себе какую-то заботу"".",Nova Kakhovka; Kakhovka Dam; Crimea; Krasnodar Krai; Vladimir Saldo;  Херson region; harvest season,Kherson Region; Vladimir Saldo; Kakhovka Hydroelectric Power Plant; Displaced People; Crimea; Krasnodar Krai,"Kherson; Ukraine; Russia; Crimea; Krasnodar Krai; Power Plant Explosions; Refugees; Return; Kherson Region; Kherson Power Plant; Kherson GES; Khersonskiy Krai; Khersonskaya GES; Khersonskiy Krai; Khersonskaya GES; Khersonskiy Krai; Khersonskaya GES; Khersonskiy Krai; Khersonskaya GES; Khersonskiy Krai; Khersonskaya GES; Khersonskiy Krai; Khersonskaya GES; Khersonskiy Krai; Khersonskaya GES; Khersonskiy Krai; Khersonskaya GES; Khersonskiy Krai; Khersonskaya GES; Khersonskiy Krai; Khersonskaya GES; Khersonskiy Krai; Khersonskaya GES; Khersonskiy Krai; Khersonskaya GES; Khersonskiy Krai; Khersonskaya GES; Khersonskiy Krai; Khersonskaya GES; Khersonskiy Krai; Khersonskaya GES; Khersonskiy Krai; Khersonskaya GES; Khersonskiy Krai; Khersonskaya GES; Khersonskiy Krai; Khersonskaya GES; Khersonskiy Krai; Khersonskaya GES; Khersonskiy Krai; Khersonskaya GES; Khersonskiy Krai; Khersonskaya GES; Khersonskiy Krai; Khersonskaya GES; Khersonskiy Krai; Khersonskaya GES; Khersonskiy Krai; Khersonskaya GES; Khersonskiy Krai; Khersonskaya GES; Khersonskiy Krai; Khersonskaya GES; Khersonskiy Krai; Khersonskaya GES; Khersonskiy Krai; Khersonskaya GES; Khersonskiy Krai; Khersonskaya GES; Khersonskiy Krai; Khersonskaya GES; Khersonskiy Krai; Khersonskaya GES; Khersonskiy Krai; Khersonskaya GES; Khersonskiy Krai; Khersonskaya GES; Khersonskiy Krai; Khersonskaya GES; Khersonskiy Krai; Khersonskaya GES; Khersonskiy Krai; Khersonskaya GES; Khersonskiy Krai; Khersonskaya GES; Khersonskiy Krai; Khersonskaya GES; Khersonskiy Krai; Khersonskaya GES; Khersonskiy Krai; Khersonskaya GES; Khersonskiy Krai; Khersonskaya GES; Khersonskiy Krai; Khersonskaya GES; Khersonskiy Krai; Khersonskaya GES; Khersonskiy Krai; Khersonskaya GES; Khersonskiy Krai; Khersonskaya GES; Khersonskiy Krai; Khersonskaya GES; Khersonskiy Krai; Khersonskaya GES; Khersonskiy Krai; Khersonskaya GES; Khersonskiy Krai; Khersonskaya GES; Khersonskiy Krai; Khersonskaya GES; Khersonskiy Krai; Khersonskaya GES; Khersonskiy Krai; Khersonskaya GES; Khersonskiy Krai; Khersonskaya GES; Khersonskiy Krai; Khersonskaya GES; Khersonskiy Krai; Khersonskaya GES; Khersonskiy Krai; Khersonskaya GES; Khersonskiy Krai; Khersonskaya GES; Khersonskiy Krai; Khersonskaya GES; Khersonskiy Krai; Khersonskaya GES; Khersonskiy Krai; Khersonskaya GES; Khersonskiy Krai; Khersonskaya GES; Khersonskiy Krai; Khersonskaya GES; Khersonskiy Krai; Khersonskaya GES; Khersonskiy Krai; Khersonskaya GES; Khersonskiy Krai; Khersonskaya GES; Khersonskiy Krai; Khersonskaya GES; Khersonskiy Krai; Khersonskaya GES; Khersonskiy Krai; Khersonskaya GES; Khersonskiy Krai; Khersonskaya GES; Khersonskiy Krai; Khersonskaya GES; Khersonskiy Krai; Khersonskaya GES; Khersonskiy Krai; Khersonskaya GES; Khersonskiy Krai; Khersonskaya GES; Khersonskiy Krai; Khersonskaya GES; Khersonskiy Krai; Khersonskaya GES; Khersonskiy Krai; Khersonskaya GES; Khersonskiy Krai; Khersonskaya GES; Khersonskiy Krai; Khersonskaya GES; Khersonskiy Krai; Khersonskaya GES; Khersonskiy Krai; Khersonskaya GES; Khersonskiy Krai; Khersonskaya GES; Khersonskiy Krai; Khersonskaya GES; Khersonskiy Krai; Khersonskaya GES; Khersonskiy Krai; Khersonskaya GES; Khersonskiy Krai; Khersonskaya GES; Khersonskiy Krai; Khersonskaya GES; Khersonskiy Krai; Khersonskaya GES; Khersonskiy Krai; Khersonskaya GES; Khersonskiy Krai; Khersonskaya GES; Khersonskiy Krai; Khersonskaya GES; Khersonskiy Krai; Khersonskaya GES; Khersonskiy Krai; Khersonskaya GES; Khersonskiy Krai; Khersonskaya GES; Khersonskiy Krai; Khersonskaya GES; Khersonskiy Krai; Khersonskaya GES; Khersonskiy Krai; Khersonskaya GES; Khersonskiy Krai; Khersonskaya GES; Khersonskiy Krai; Khersonskaya GES; Khersonskiy Krai; Khersonskaya GES; Khersonskiy Krai; Khersonskaya GES; Khersonskiy Krai; Khersonskaya GES; Khersonskiy Krai; Khersonskaya GES; Khersonskiy Krai; Khersonskaya GES; Khersonskiy Krai; Khersonskaya GES; Khersonskiy Krai; Khersonskaya GES; Khersonskiy Krai; Khersonskaya GES; Khersonskiy Krai; Khersonskaya GES; Khersonskiy Krai; Khersonskaya GES; Khersonskiy Krai; Khersonskaya GES; Khersonskiy Krai; Khersonskaya GES; Khersonskiy Krai; Khersonskaya GES; Khersonskiy Krai; Khersonskaya GES; Khersonskiy Krai; Khersonskaya GES; Khersonskiy Krai; Khersonskaya GES; Khersonskiy Krai; Khersonskaya GES; Khersonskiy Krai; Khersonskaya GES; Khersonskiy Krai; Khersonskaya GES; Khersonskiy Krai; Khersonskaya GES; Khersonskiy Krai; Khersonskaya GES; Khersonskiy Krai; Khersonskaya GES; Khersonskiy Krai; Khersonskaya GES; Khersonskiy Krai; Khersonskaya GES; Khersonskiy Krai; Khersonskaya GES; Khersonskiy Krai; Khersonskaya GES; Khersonskiy Krai; Khersonskaya GES; Khersonskiy Krai; Khersonskaya GES; Khersonskiy Krai; Khersonskaya GES; Khersonskiy Krai; Khersonskaya GES; Khersonskiy Krai; Khersonskaya GES; Khersonskiy Krai; Khersonskaya GES; Khersonskiy Krai; Khersonskaya GES; Khersonskiy Krai; Khersonskaya GES; Khersonskiy Krai; Khersonskaya GES; Khersonskiy Krai; Khersonskaya GES; Khersonskiy Krai; Khersonskaya GES; Khersonskiy Krai; Khersonskaya GES; Khersonskiy Krai; Khersonskaya GES; Khersonskiy Krai; Khersonskaya GES; Khersonskiy Krai; Khersonskaya GES; Khersonskiy Krai; Khersonskaya GES; Khersonskiy Krai; Khersonskaya GES; Khersonskiy Krai; Khersonskaya GES; Khersonskiy Krai; Khersonskaya GES; Khersonskiy Krai; Khersonskaya GES; Khersonskiy Krai; Khersonskaya GES; Khersonskiy Krai; Khersonskaya GES; Khersonskiy Krai; Khersonskaya GES; Khersonskiy Krai; Khersonskaya GES; Khersonskiy Krai; Khersonskaya GES; Khersonskiy Krai; Khersonskaya GES; Khersonskiy Krai; Khersonskaya GES; Khersonskiy Krai; Khersonskaya GES; Khersonskiy Krai; Khersonskaya GES; Khersonskiy Krai; Khersonskaya GES; Khersonskiy Krai; Khersonskaya GES; Khersonskiy Krai; Khersonskaya GES; Khersonskiy Krai; Khersonskaya GES; Khersonskiy Krai; Khersonskaya GES; Khersonskiy Krai; Khersonskaya GES; Khersonskiy Krai; Khersonskaya GES; Khersonskiy Krai; Khersonskaya GES; Khersonskiy Krai; Khersonskaya GES; Khersonskiy Krai; Khersonskaya GES; Khersonskiy Krai; Khersonskaya GES; Khersonskiy Krai; Khersonskaya GES; Khersonskiy Krai; Khersonskaya GES; Khersonskiy Krai; Khersonskaya GES; Khersonskiy Krai; Khersonskaya GES; Khersonskiy Krai; Khersonskaya GES; Khersonskiy Krai; Khersonskaya GES; Khersonskiy Krai; Khersonskaya GES; Khersonskiy Krai; Khersonskaya GES; Khersonskiy Krai; Khersonskaya GES; Khersonskiy Krai; Khersonskaya GES; Khersonskiy Krai; Khersonskaya GES; Khersonskiy Krai; Khersonskaya GES; Khersonskiy Krai; Khersonskaya GES; Khersonskiy Krai; Khersonskaya GES; Khersonskiy Krai; Khersonskaya GES; Khersonskiy Krai; Khersonskaya GES; Khersonskiy Krai; Khersonskaya GES; Khersonskiy Krai; Khersonskaya GES; Khersonskiy Krai; Khersonskaya GES; Khersonskiy Krai; Khersonskaya GES; Khersonskiy Krai; Khersonskaya GES; Khersonskiy Krai; Khersonskaya GES; Khersonskiy Krai; Khersonskaya GES; Khersonskiy Krai; Khersonskaya GES; Khersonskiy Krai; Khersonskaya GES; Khersonskiy Krai; Khersonskaya GES; Khersonskiy Krai; Khersonskaya GES; Khersonskiy Krai; Khersonskaya GES; Khersonskiy Krai; Khersonskaya GES; Khersonskiy Krai; Khersonskaya GES; Khersonskiy Krai; Khersonskaya GES; Khersonskiy Krai; Khersonskaya GES; Khersonskiy Krai; Khersonskaya GES; Khersonskiy Krai; Khersonskaya GES; Khersonskiy Krai; Khersonskaya GES; Khersonskiy Krai; Khersonskaya GES; Khersonskiy Krai; Khersonskaya GES; Khersonskiy Krai; Khersonskaya GES,",New Kakhovka; Chernobyl Dam Collapse; Kherson Region,Kakhovka Dam; Novoukrainka; displacement; return of residents; harvest season; Vladimir Saldo; Kherson Oblast
